日付,見出し,詳細,詳細画像URL,リンクの見出し,リンクのURL
2024.10.11,水道工事まもなく完成いたします。,"川口市東本郷地区にて3月より進めておりました水道管の布設工事につきまして、現在、配管を施工した道路の舗装工事を行っております。<br><br>

通行止めの期間中、周辺住民の皆様ならびに通行者の皆様に多大なるご協力をいただき、心より感謝申し上げます。<br><br>

工事はまもなく全て完了する予定です。引き続き、皆様のご理解とご協力を賜りますよう、何卒よろしくお願い申し上げます。",https://drive.google.com/file/d/1hR-p_3DpTYWULBDKCDqsoTBWEt5UUHK4/view?usp=sharing,,
2024.10.10,川口市より優秀建設工事施工業者表彰をいただきました,"このたび、弊社は川口市より令和６年度優秀建設工事施工業者表彰をいただきまた。これもひとえに日頃よりご支援いただいております皆様のおかげと心より感謝申し上げます。<br>
今回の受賞は、以下３件の工事が評価された結果です。<br>・網代橋改修工事<br>・石神西立野特定土地区画整理事業 都市計画道路石神戸塚線橋梁建設工事<br>・川口第３処理分区汚水管渠２工区築造工事
<br>
今後も、さらなる技術の向上および品質管理の強化に努め、地域社会から信頼され続ける企業を目指してまいります。",https://drive.google.com/file/d/1-RBvA6CEJj6wzUwVghjy-FdKKk-rgvLh/view?usp=sharing,,
2024.8.2,夏季休業のお知らせ,"平素は格別のご愛顧を賜り、厚く御礼申し上げます。<br>
誠に勝手ながら、以下の期間を夏季休業とさせていただきます。<br>
ご不便をおかけ致しますが、何卒ご理解の程お願い申し上げます。<br>
<br>
■夏季休業期間：
2024年8月10日（土）～8月18日（日）<br>
※2024年8月19日（月）より、通常通り営業いたします。
<br><br>
夏季休業期間中に頂きましたお問い合わせにつきましては、2024年8月19日（月）以降、順次対応させていただきます。",,,
2024.7.25,暑気払いを行いました,例年にも増して厳しい暑さが続いておりますが、現場監督、作業員の皆さまに労をねぎらうため、暑気払いを行いました。昨年は屋外でバーベキューを開催しましたが、今年は屋内で涼しい環境を確保し、おいしい食事とお酒を用意しました。お盆までの無事故を願い、皆さまの健康と安全に配慮しながら、作業に励んでいただきます。,https://drive.google.com/file/d/1woSjm28wSqvKEiTKsVy-9M4XeJM65C6w/view?usp=sharing,,
2024.7.20,特別教育を行いました," 7月20日に従業員の安全意識向上を目的とした特別研修を実施しました。現場監督、作業員には刈払機の安全取扱いについて、外国人実習生にはフルハーネスの使用方法について母国語で徹底した指導を行いました。<br><br>

暑い環境での長時間の研修となりましたが、一人ひとりが作業の危険性を再認識し、安全対策の重要性を学ぶ良い機会となりました。当社では今後も定期的な安全教育を実施し、従業員の皆様が安心して働ける環境づくりに努めてまいります。",https://drive.google.com/file/d/1j1o0c_d1IOWcviqacgWgCwg26CgN-vfY/view?usp=sharing,特別教育,
2024.6.26,新河岸川の築堤工が完成いたしました,長らく完成をお待たせいしておりました、朝霞県土整備事務所発注の２５２０交付金（河川）整備工事（築堤工その１０）につきまして、この度工事を完成いたしました。新河岸川がより水害に強い河川となり、皆様の安心安全に貢献できたことを大変うれしく思います。今後とも、より災害に強いまちづくりに貢献させていただきたいと考えてております。,https://drive.google.com/file/d/1VC-jdJvktvMCmrJ26HKRPFQhRMAGDg2N/view?usp=sharing,新河岸川空撮,
2024.5.9,埼玉県アライチャレンジ企業に登録いたしました,"性の多様性に配慮した様々な取り組みにチャレンジする「埼玉県アライチャレンジ企業」として登録させていただきました。この登録は、LGBTQを理解し、支援している人、または支援したいと思う人であることを示す""アライ""として、性の多様性を尊重し、働きやすい職場環境を整備する取組の一環として行われました。この度の登録に対する皆様のご理解とサポートに感謝申し上げます。今後ともよろしくお願い申し上げます。",https://drive.google.com/file/d/1h5UMOb8oKzdNaaw01zMkxYjXqzq1lTS2/view?usp=sharing,登録証,
2024.4.11,岸川中学校の学習企業講演に参加をいたしました, 先日、岸川中学校にて行われました、学習企業講演に参加をいたしました。公共工事を行う会社がどのような仕事をしているのか、SDGs（持続可能な開発目標）に対し、どのような取り組みをおこっているのかを説明させていただきました。このような場を設けていただきました、学校、先生方、生徒皆様に感謝申し上げます。,https://drive.google.com/file/d/1H8iwe_Az_x_ovidvCb3PcxXKSuiF-e5q/view?usp=sharing,学習企業講演,
2024.3.22,地球温暖化の防止に貢献しています,緑の募金を通じて行われた植樹活動により、CO₂の吸収量を4トン削減することができました。これは、私たちの環境への責任と、持続可能な未来へのコミットメントを示す大きな一歩です。私たちは、この成果を皆様と共有し、さらなる環境保全活動への意識を高めることを願っています。今後も、地球環境の改善に向けて、一層の努力を続けてまいります。,https://drive.google.com/file/d/1st1fv9unyEH0zNO-oaVeigliH5dlpqvJ/view?usp=sharing,認証書,
2024.3.19,網代橋の改修工事が完成いたしました, 安行領根岸の芝川にかかる網代橋の長寿命化に伴う改修工事が、本日の検査をもって完成となりました。写真は、あまり目には触れない桁の部分のものです。今後とも、安心安全かつ効率的な工事を心掛け、地域のみなさまに貢献できるよう努めてまいります。,https://drive.google.com/file/d/1VjvMpvfsSqWH71gkM-q-dylXl3eFYAuB/view?usp=sharing,,
2024.3.6,網代橋の改修工事まもなく完成です," 安行領根岸の芝川にかかる網代橋の長寿命化に伴う改修工事におきまして、足場を撤去し、きれいに塗装しなおされた状況を見ることができるようになりました。粉塵を外に漏らさないよう密閉され、専用のマスクや防護服を着用の中での作業でしたが、無事完成し、あとは検査を待つばかりの状況となっております。
 周辺にお住まいの皆様には、工事へのご協力をいただき、大変ありがたく存じます。 今後とも、安心安全かつ効率的な工事を心掛け、地域のみなさまに貢献できるよう努めてまいります。",https://drive.google.com/file/d/1b40Cav0ZYYCgK3JgIJf4pMOP2QCzs4zm/view?usp=sharing,,
2024.2.15,水道工事まもなく完成いたします。,"川口市青木地内にて８月より施工しておりました、水道管の布設工事につきまして、配管を行いました道路の舗装がこの度完成し、まもなくすべての工事が完了いたします。
周辺住民の皆様にはご協力をいただき、大変ありがたく存じます。
今後とも、安心安全かつ効率的な工事を心掛け、地域のみなさまに貢献できるよう努めてまいります。",https://drive.google.com/file/d/1lqbbYFTxqixLF5fMF5kOe6fD40QTs1dO/view?usp=sharing,舗装仕上がり状況,
2024.2.13,ホームページをリニューアルしました。,ホームページをリニューアルしました。,,,
2024.2.6,網代橋の中間検査を行いました,現在、安行領根岸の芝川にかかる網代橋において、橋の改修工事を行われており、１月１８日に中間検査がおこなわれました。既存塗料、さび等を落とす際の粉塵を外に出さないために密閉された中で作業しております。外からは見ることができないのですが、中では写真のような作業が行われております。作業の安全と環境への配慮を確保し、３月末までに工事を完了する予定です。もうしばらく、ご不便をおかけすることになりますが、何卒、作業へのご理解ご協力をお願いいたします。,https://drive.google.com/file/d/1Kq1uJ7wqvQ3NH_c-TjAR-OtAvzz6wzZE/view?usp=sharing,,
2024.1.24,安行小山地内での下水道工事が完成いたしました,"川口市安行小山地内にて６月より施工しておりました、下水道管の布設工事がこの度完成いたしました。
周辺住民の皆様にはご協力をいただき、大変ありがたく存じます。<br>
今後とも、安心安全かつ効率的な工事を心掛け、地域のみなさまに貢献できるよう努めてまいります。",https://drive.google.com/file/d/1qyTitMUl-kaiZcvGrtIokfjz5SH9d8gO/view?usp=sharing,安行小山地内での下水道工事,
2024.1.18,赤井地内での下水道工事が完成いたしました,"川口市大字赤井地内にて６月より施工しておりました、下水道管の布設工事がこの度完成いたしました。
周辺住民の皆様にはご協力をいただき、大変ありがたく存じます。
今後とも、安心安全かつ効率的な工事を心掛け、地域のみなさまに貢献できるよう努めてまいります。",https://drive.google.com/file/d/1L_OKCs1ivPT9cIpG_1_2enJ-ayU2WJmK/view?usp=sharing,赤井地内での下水道工事,